guid_oks,full_name,tip_oks,vid_stoi,f_name,sost_oks,stad_oks,sost_zem,name_tep,znach_tep,tep_oks,address_oks,region,mun_obr,latit_oks,longit_oks,create_date,zpo_n,zpo_k,ird_n,ird_k,pir_st,pir_fn,smr_st,smr_fn,plan_vvod,rol_org,zak_inn,zak_kpp,resp_mail
6b6414e2-046a-4494-a7d2-32daaa3fd6f9,"Работы по восстановлению и усилению строительных конструкций здания поликлиники ГБУЗ ""Районная больница г.Катав-Ивановск"" в ходе капитального ремонта","ОКС, (за исключением линейных)","Строительство ОКС, не являющийся линейным или ОКН",03.01.001.002 Здание клинической больницы,СМР,СМР,"Свободна, передана",Посетители,1000,чел,г. Катав-Ивановск,Челябинская область,Катав-Ивановский муниципальный район,"54,741278","58,191819",18.11.2024,10.10.2023,31.12.2023,01.02.2024,06.07.2024,24.06.2024,31.12.2024,16.04.2025,30.07.2027,31.12.2027,Заказчик,7410005894,745701001,a.stepanov@katavivan.gov74.ru
2286a8ca-a4d4-42b8-a17d-231a63553fb8,24-106980Э Капитальный ремонт моста через реку Миасс по автомобильной дороге ул. Черкасской (восточный),Линейный объект,Капитальный ремонт линейных объектов,"04.06.001.001 Сооружение автодорожного моста, 04.06.001.001 Сооружение автодорожного моста",СМР,СМР,"Свободна, передана",Протяженность линейного ОКС,76,,Ул. Черкасская,Челябинская область,Челябинский,"55,235907","61,377838",11.12.2024,25.04.2024,30.01.2025,25.04.2024,03.06.2024,03.06.2024,10.07.2024,21.11.2024,30.06.2027,24.12.2027,Заказчик,7451227906,744801001,sdo-gti@mail.ru
eef599b1-7719-4575-a877-87f222eb6595,"Разработка проектной и рабочей документации по объекту: «Здание средней школы», расположенного по адресу г. Снежинск, микрорайон №20 (в т.ч. проектно - изыскательские работы)","ОКС, (за исключением линейных)","Строительство ОКС, не являющийся линейным или ОКН",02.03.002.003 Здание средней школы,ПИР,Подготовка ПД,Передана условно,Посетители,500,чел,г. Снежинск,Челябинская область,Снежинский,"54,741278","58,191819",31.01.2025,10.10.2023,31.12.2023,01.02.2024,06.07.2024,17.01.2025,31.08.2025,12.02.2026,10.10.2026,15.02.2027,Заказчик,7423015057,745901001,coys02@yandex.ru
f7b5c3f0-6494-46f6-9f7a-d474d2558ede,"Капитальный ремонт здания МОУ ""Миасская СОШ №2"", расположенного в селе Миасское Красноармейского района Челябинской области","ОКС, (за исключением линейных)","Капитальный ремонт ОКС, не являющийся линейным или ОКН",02.03.002. Объекты среднего образования,СМР,СМР приостановлены,Не передана,Полезная площадь ОКС,"5568,5",квадратный метр,"с. Миасское, ул. Школьная, 2А",Челябинская область,Красноармейский муниципальный район,"55,290367","61,889276",04.02.2025,01.02.2025,31.03.2025,15.04.2025,31.05.2025,04.06.2025,01.10.2025,06.02.2026,31.12.2026,01.01.2027,Заказчик,7430013766,743001001,upr0909@mail.ru
b920b1f5-1cc6-446f-9efd-15d2399f6bb7,"Строительство спального корпуса на 50 мест со спортзалом и спортивной площадкой на территории МКОУ СШИ № 8 г.Пласт, ул.Коминтерна, д.62","ОКС, (за исключением линейных)","Строительство ОКС, не являющийся линейным или ОКН",02.03.002. Объекты среднего образования,СМР,СМР,"Свободна, передана",Площадь застройки,"967,36",м^2,Улица Коминтерна д.62.,Челябинская область,Пластовский муниципальный округ,"54,367929","60,794624",12.03.2025,10.10.2023,31.12.2023,01.02.2024,06.07.2024,01.02.2024,10.09.2024,11.03.2025,31.12.2026,01.06.2027,Заказчик,7451471446,745101001,uez-plast@yandex.ru
91633e02-7b67-4375-ac9b-d37fea241ed8,Выполнение работ по реконструкции мостового перехода через реку Симок на 20 км автомобильной дороги Катав-Ивановск - Серпиевка - Аратское,Линейный объект,Реконструкция линейных объектов,04.01.001.003 Обычная автомобильная дорога (нескоростная автомобильная дорога) вне населенного пункта,СМР,СМР,Свободна,Протяженность линейного ОКС,"0,5",км,мостовой переход через реку Симок на км 20 автомобильной дороги Катав-Ивановск – Серпиевка – Аратское,Челябинская область,Катав-Ивановский муниципальный район,"54,790075","57,904976",18.03.2025,18.03.2016,18.04.2019,01.07.2021,01.08.2021,02.09.2021,15.04.2022,01.04.2025,30.04.2026,30.04.2026,Заказчик,7451384218,745101001,otdrazv@mindortrans74.ru
c603b3a0-285d-4e94-9b88-698b0ffe25d9,"Реконструкция стадиона МБУ ""спортивная школа г. Нязепетровска"", расположенный по адресу: Челябинская область, г. Нязепетровск, ул.  Клубная, д. 20","ОКС, (за исключением линейных)","Реконструкция ОКС, не являющийся линейным или ОКН","03.04.001. Стадионы, арены",СМР,СМР,"Свободна, передана",Площадь застройки,21177,м^2,"г. Нязепетровск, ул. Клубная, д. 20",Челябинская область,Нязепетровский муниципальный округ,"56,020906","59,596713",24.03.2025,10.02.2025,20.02.2025,20.04.2022,08.12.2023,20.04.2022,08.12.2023,01.04.2025,30.09.2027,31.12.2027,Заказчик,7402010570,745901001,sherstnev1982s@yandex.ru
ef671092-aa98-4d9b-85a0-0ceb4bb9abe3,"Капитальный ремонт покрытия проезжей части ул. Ленина, расположенной по адресу: Челябинская область, Уйский район,  с. Маслово",Линейный объект,Капитальный ремонт линейных объектов,04.01.001. Автомобильные дороги,СМР,Торги на Подрядчика на СМР,Свободна,Протяженность линейного ОКС,"0,668",Км.,"с. Маслово, ул. Ленина",Челябинская область,Уйский муниципальный район,"54,466407","60,027197",26.03.2025,28.02.2023,05.08.2023,10.09.2023,03.03.2024,01.05.2024,26.12.2024,17.03.2025,25.02.2026,26.02.2026,Заказчик,7441002710,741501001,arhitektura74525@mail.ru
88ac05f8-bbdb-4527-afb7-e20f5e62e977,"Капитальный ремонт покрытия проезжей части улиц Молодежная и Труда, переулков от улицы Ленина до улицы Юбилейная,36 и до улицы Юбилейная,30",Линейный объект,Капитальный ремонт линейных объектов,04.01.001. Автомобильные дороги,СМР,Торги на Подрядчика на СМР,Свободна,Протяженность линейного ОКС,"0,896",Км.,"с. Кидыш, ул. Труда",Челябинская область,Уйский муниципальный район,"54,151765","60,084896",26.03.2025,28.02.2023,05.08.2023,10.09.2023,03.03.2024,01.05.2024,26.12.2024,01.05.2025,31.12.2025,20.02.2026,Заказчик,7441002710,741501001,arhitektura74525@mail.ru
253910b3-98fb-4c72-ac35-c45270314b69,Строительство мостового перехода через реку Бия на км 268+001 автомобильной дороги Бирск Башкортостана - Тастуба Башкортостана - Сатка,Линейный объект,Строительство линейных объектов,04.01.001.003 Обычная автомобильная дорога (нескоростная автомобильная дорога) вне населенного пункта,СМР,СМР,Свободна,Протяженность линейного ОКС,"0,15",км,мостового перехода через реку Бия на км 268+001 автомобильной дороги Бирск Башкортостана - Тастуба Башкортостана - Сатка,Челябинская область,Саткинский муниципальный округ,"55,149686","58,841565",28.03.2025,19.09.2018,02.03.2019,01.04.2020,01.05.2020,10.06.2020,23.03.2021,01.04.2025,01.04.2026,01.04.2026,Заказчик,7451384218,745101001,otdrazv@mindortrans74.ru
e26520f0-21c6-4b68-a727-f8b34b86cd10,"«Реконструкция газовой котельной №2 в с.Варламово», расположенного по адресу Челябинская область, Чебаркульский район, с.Варламово, ул. Сейфуллиной 13 А","ОКС, (за исключением линейных)","Строительство ОКС, не являющийся линейным или ОКН",12.01.001.002 Здание котельной,СМР,СМР,"Свободна, передана",Полезная площадь ОКС,"270,86",м3,"с.Варламово, ул. Сейфуллиной 13 А",Челябинская область,Чебаркульский муниципальный район,"54,621149","60,662614",31.03.2025,28.02.2023,05.08.2023,10.09.2023,03.03.2024,01.05.2024,11.12.2024,07.04.2025,31.12.2025,15.02.2026,Заказчик,7442003000,741501001,ku-zubenko@mail.ru
41c37c3e-a174-4b88-ab60-ad4ded19760e,"Капитальный ремонт автомобильной дороги по ул.Братьев Кашириных от ул. Чичерина до ул. Северо-Крымской""",Линейный объект,Капитальный ремонт линейных объектов,"04.01.001.002 Дорога, улица в границах населенного пункта, 04.01.001.002 Дорога, улица в границах населенного пункта",СМР,Передача Строительной площадки Подрядчику/Генеральному Подрядчику,Передана условно,Протяженность линейного ОКС,3.6 км,,ул. Братьев Кашириных,Челябинская область,Челябинский,"55,17341","61,304702",14.05.2025,01.01.2025,31.01.2025,03.02.2025,31.03.2025,01.04.2025,20.08.2025,01.05.2025,31.08.2026,31.12.2026,Заказчик,7451227906,744801001,buylo@mail.ru
1c5e9f0a-28ae-4e89-aa69-e264ddfd23b3,"Капитальный ремонт стрелкового тира, расположенного по адресу: Челябинская область, г. Снежинск, ул. 40 лет Октября, 35","ОКС, (за исключением линейных)","Строительство ОКС, не являющийся линейным или ОКН","03. Здравоохранение, спорт, физическая культура, отдых и развлечения",СМР,Передача Строительной площадки Подрядчику/Генеральному Подрядчику,Не передана,Площадь застройки,1267,м^2,"Челябинская область, г. Снежинск, ул. 40 лет Октября, 35",Челябинская область,Снежинский,"56,085","60,7314",19.05.2025,28.02.2023,05.08.2023,10.09.2023,03.03.2024,01.05.2024,11.12.2024,12.05.2025,30.04.2026,30.04.2026,Заказчик,7423015057,745901001,coys02@yandex.ru
f2438a21-54e9-4a13-82aa-643dad3b39d0,Капитальный ремонт здания женской консультации ГАУЗ ОЗП «ГКБ № 8 г.Челябинск»,"ОКС, (за исключением линейных)","Капитальный ремонт ОКС, не являющийся линейным или ОКН",03.01.006.003 Здание женской консультации,СМР,СМР,Занята,"Капитальный ремонт здания женской консультации ГАУЗ ОЗП «ГКБ № 8 г. Челябинск по адресу: г. Челябинск, ул. Котина, 37а","2393,89",м.кв.,"г. Челябинск, ул. Котина, 37а",Челябинская область,Челябинский,"55,173905","61,433563",22.05.2025,28.02.2023,05.08.2023,10.09.2023,03.03.2024,01.05.2024,01.12.2024,24.01.2025,24.02.2026,03.03.2026,Заказчик,7452000312,745201001,hoz@chelgkb8.ru
60883366-2ffb-46f9-9f1a-0194bf13a4a2,Наружное газоснабжение жилых домов в д. Болотово Чебаркульского района Челябинской области,Линейный объект,Строительство линейных объектов,12. Инженерные сети и объекты инфраструктуры,СМР,СМР,Не передана,Протяженность линейного ОКС,"6602,8",м.п.,д. Болотово,Челябинская область,Чебаркульский муниципальный район,"54,731968","60,252416",28.05.2025,01.04.2024,13.06.2024,21.07.2024,01.12.2024,11.12.2024,04.03.2025,04.04.2025,30.12.2025,16.03.2026,Заказчик,7415107297,741501001,ku-zubenko@mail.ru
ebd0fc1f-d411-4db8-8a7b-df53c66497e8,Капитальный ремонт наружных сетей теплоснабжения (участок от ТК-4-ТК№5-ТК№6-ТК№36-ТК№14-ТК№15-ТК№16) по ул. Маландина в п. Тимирязевский Чебаркульского района Челябинской области,Линейный объект,Капитальный ремонт линейных объектов,12. Инженерные сети и объекты инфраструктуры,СМР,СМР,Передана условно,Протяженность линейного ОКС,1228,м.п.,ул. Маландина в п. Тимирязевский,Челябинская область,Чебаркульский муниципальный район,"54,927693","60,764748",28.05.2025,30.05.2024,23.08.2024,01.09.2024,27.12.2024,13.01.2025,11.04.2025,14.04.2025,27.01.2026,30.01.2026,Заказчик,7415107297,741501001,
7a70bb81-deee-4852-8852-d188fec39320,"Капитальный ремонт наружных сетей теплоснабжения по адресу: Челябинская область, Чебаркульский район, п. Тимирязевский, ул. Мичурина",Линейный объект,Капитальный ремонт линейных объектов,12. Инженерные сети и объекты инфраструктуры,СМР,СМР,Передана условно,Протяженность линейного ОКС,1408,м.п.,ул. Мичурина в п. Тимирязевский,Челябинская область,Чебаркульский муниципальный район,"54,928483","60,761045",28.05.2025,05.06.2024,07.10.2024,09.10.2024,27.12.2024,13.01.2025,07.04.2025,08.04.2025,25.03.2026,28.03.2026,Заказчик,7442006273,741501001,ku-zubenko@mail.ru
ae5b31f1-3ce4-45dd-8464-58cf608aa1a5,Капитальный ремонт наружных сетей теплоснабжения по ул.8 Марта в с. Филимоново  Чебаркульского района Челябинской области,Линейный объект,Капитальный ремонт линейных объектов,12. Инженерные сети и объекты инфраструктуры,СМР,СМР,Передана условно,Протяженность линейного ОКС,705,м.п.,ул. 8 Марта в с. Филимоново,Челябинская область,Чебаркульский муниципальный район,"54,714936","60,073938",28.05.2025,17.05.2023,17.11.2023,10.01.2024,18.04.2024,12.06.2024,12.12.2024,08.04.2025,31.12.2025,16.02.2026,Заказчик,7415107297,741501001,ku-zubenko@mail.ru
b646d964-7e3f-429d-91f6-ba6c01881d29,"Выполнение строительно-монтажных работ по объекту ""Капитальный ремонт автомобильной дороги по улице Советской в пос. Увельский""",Линейный объект,Капитальный ремонт линейных объектов,"04.01.001.002 Дорога, улица в границах населенного пункта",СМР,СМР,"Свободна, передана",Протяженность линейного ОКС,1623,м,"п. Увельский, ул. Советская",Челябинская область,Увельский муниципальный район,"54,439303","61,349652",11.06.2025,15.04.2025,10.05.2025,15.04.2025,10.05.2025,15.04.2025,10.05.2025,10.05.2025,31.12.2025,19.03.2026,Заказчик,7451471365,745101001,mariiavakhrusheva@yandex.ru
6d22401c-44a0-4776-a4fb-b65b737a2023,"Выполнение работ по «Капитальному ремонту инженерных сетей - водовода (г. Челябинск, Шершневское водохранилище - г. Коркино, ул. Деповская)». Участок №1, «Капитальному ремонту инженерных сетей - водовода (г. Челябинск, Шершневское водохранилище - г. Коркино, ул. Деповская)». Участок №2, «Капитальному ремонту инженерных сетей - водовода (г. Челябинск, Шершневское водохранилище - г. Коркино, ул. Деповская)». Участок №4",Линейный объект,Капитальный ремонт линейных объектов,12. Инженерные сети и объекты инфраструктуры,СМР,Передача Строительной площадки Подрядчику/Генеральному Подрядчику,"Свободна, передана",Длина/диаметр,"1242,5/700",м/мм,"г. Челябинск, Шершневское водохранилище - г. Коркино, ул. Деповская",Челябинская область,Коркинский муниципальный округ,"23,185274","59,321492",24.06.2025,08.11.2023,08.11.2023,01.05.2023,30.05.2023,01.05.2023,30.05.2023,01.07.2025,30.04.2026,30.04.2026,Заказчик,7412003162,743001001,silivanovvn@mail.ru
e3a01875-0723-4979-8e77-a77ada1b80e5,Капитальный ремонт водопровода от ВК-37 до ВК-46 по ул. Щербакова в г. Нязепетровске Челябинсакой области,"ОКС, (за исключением линейных)","Капитальный ремонт ОКС, не являющийся линейным или ОКН",12.01.004.001 Линейное сооружение сети водоснабжения,СМР,СМР,Свободна,Протяженность,"367,5",метр,"Че5лябинская область, г. Нязепетровск, ул. Щербакова от ВК-37 до ВК-46",Челябинская область,Нязепетровский муниципальный округ,"56,053829","59,597003",21.08.2025,,,,,01.04.2025,30.07.2025,01.08.2025,28.04.2026,30.04.2026,Заказчик,7402010570,745901001,
270c2557-c594-46c5-98c5-c225e4776401,Строительство автомобильной дороги от ул. Обуховской до ул. Горелова,Линейный объект,Строительство линейных объектов,"04.01.001.002 Дорога, улица в границах населенного пункта",СМР,СМР,"Свободна, передана",Категория- улица в зоне жилой застройки местного значения,"0,20204",км,"Челябинская область, г. Челябинск. Ленинский район",Челябинская область,Челябинский,"55,71782","61,29532",08.09.2025,,,,,30.04.2025,10.06.2025,15.06.2025,20.07.2026,30.12.2026,Заказчик,7451227906,744801001,sdo-gti@mail.ru
cab193fd-0ab8-41c8-931d-67f801743451,Капитальный ремонт здания женской консультации ГАУЗ ОЗП «ГКБ № 8 г.Челябинск»,"ОКС, (за исключением линейных)","Капитальный ремонт ОКС, не являющийся линейным или ОКН",03.01.006.003 Здание женской консультации,СМР,СМР,Занята,"Капитальный ремонт здания женской консультации ГАУЗ ОЗП «ГКБ № 8 г. Челябинск по адресу: г. Челябинск, ул. Котина, 37а",Женская консультация,"здание общей площадью 2393,89м.кв.","г. Челябинск, ул. Котина, 37а",Челябинская область,Челябинский,"55,174069","61,442872",19.09.2025,,,,,01.05.2024,01.12.2025,20.12.2024,30.04.2026,25.05.2026,Заказчик,7452000312,745201001,hoz@chelgkb8.ru
ff357bb7-45dd-418e-80cb-96e0a1662f3b,"капитальный ремонт объекта муниципальной собственности Златоустовского городского округа – нежилое помещение (подвал (убежище) кадастровый номер: 74:25:0308205:99, расположенное по адресу: Челябинская область, г. Златоуст, пр. Мира",,"Капитальный ремонт ОКС, не являющийся линейным или ОКН",03.02. Объекты для кратковременного проживания,СМР,СМР,Свободна,229,площадь объекта,м2,"нежилое помещение (подвал (убежище) кадастровый номер: 74:25:0308205:99, расположенное по адресу: Челябинская область, г. Златоуст, пр. Мира",Челябинская область,Златоустовский,"55,126966","59,679208",25.09.2025,,,,,02.07.2025,31.12.2025,22.07.2025,31.05.2026,01.06.2026,Заказчик,7404055142,740401001,ukszlat@yandex.ru
a39a232d-7adf-4959-8cfc-bbc4ac852c9b,Капитальный ремонт автодороги по ул. Мамина Сибиряка – ул. Мира (от перекрестка ул. Освобождения Урала и ул. Мамина Сибиряка до автодороги Миасс-Карабаш-Кыштым) в г. Кыштыме Челябинской области,"ОКС, (за исключением линейных)","Капитальный ремонт ОКС, не являющийся линейным или ОКН","04.01.001.002 Дорога, улица в границах населенного пункта",СМР,СМР,Передана частично,,,,г. Кыштым,Челябинская область,Кыштымский,"55,69704","60,51007",14.10.2025,,,,,02.07.2025,18.08.2025,25.08.2025,01.04.2026,01.05.2026,Заказчик,7413000326,741301001,irina.sigovasafina@mail.ru
c0193875-dd1c-4991-8c75-9f8e2301b915,"Выполнение строительно-монтажных работ по объекту: ""Строительство автомобильного моста через р. Зюзелга в пос. Есаульский Сосновского района Челябинской области",Линейный объект,"Строительство ОКС, не являющийся линейным или ОКН",04.06.001.001 Сооружение автодорожного моста,СМР,СМР,"Свободна, передана",Протяжение,265,м,"Российская Федерация, Челябинская область, Сосновский р-н, п. Есаульский",Челябинская область,Сосновский муниципальный район,"55,29776","61,2207",29.10.2025,,,,,07.10.2024,12.09.2025,07.10.2025,20.07.2026,30.08.2026,Заказчик,7438002100,746001001,
